{
  "schemaVersion": 1,
  "composition": "cmre-porting-test",
  "nodes": [
    {
      "id": "adapters/dead-of-night/LibDeadOfNightObserver_h.galaxy",
      "kind": "galaxy-library",
      "path": "adapters/dead-of-night/LibDeadOfNightObserver_h.galaxy",
      "metadata": {
        "packageId": "cmre-adapters",
        "bytes": 475,
        "parseErrors": 0,
        "functions": 2,
        "calls": 0,
        "apiCalls": {
          "trigger": [],
          "bank": [],
          "objective": [],
          "reward": [],
          "initializer": []
        }
      }
    },
    {
      "id": "adapters/dead-of-night/LibDeadOfNightObserver.galaxy",
      "kind": "galaxy-library",
      "path": "adapters/dead-of-night/LibDeadOfNightObserver.galaxy",
      "metadata": {
        "packageId": "cmre-adapters",
        "bytes": 1869,
        "parseErrors": 0,
        "functions": 2,
        "calls": 8,
        "apiCalls": {
          "trigger": [],
          "bank": [],
          "objective": [],
          "reward": [],
          "initializer": []
        }
      }
    }
  ],
  "edges": [
    {
      "from": "adapters/dead-of-night/LibDeadOfNightObserver.galaxy",
      "to": "adapters/dead-of-night/LibDeadOfNightObserver_h.galaxy",
      "relation": "includes",
      "evidence": [
        "adapters/dead-of-night/LibDeadOfNightObserver.galaxy:2"
      ]
    }
  ],
  "unresolved": [
    {
      "description": "Unresolved include: TriggerLibs/natives from adapters/dead-of-night/LibDeadOfNightObserver_h.galaxy",
      "requiredEvidence": "static"
    },
    {
      "description": "Unresolved include: LibPortingObserver_h from adapters/dead-of-night/LibDeadOfNightObserver_h.galaxy",
      "requiredEvidence": "static"
    },
    {
      "description": "Unresolved include: TriggerLibs/natives from adapters/dead-of-night/LibDeadOfNightObserver.galaxy",
      "requiredEvidence": "static"
    },
    {
      "description": "Unresolved call: libPortingObserver_gf_Publish in adapters/dead-of-night/LibDeadOfNightObserver.galaxy (3 occurrences)",
      "requiredEvidence": "static"
    }
  ]
}
